<?xml version="1.0" encoding="UTF-8"?>
<sudoku xmlns:xsi="http://www.w3.org/2001/XMLSchema-instance"
        xsi:noNamespaceSchemaLocation="sudoku_schema.xsd">
    
    <row>
        <cell/><cell/><cell/><cell/><cell/><cell/><cell/><cell/><cell/>
    </row>
    <row>
        <cell/><cell/><cell/><cell/><cell/><cell/><cell/><cell/><cell/>
    </row>
    <row>
        <cell/><cell/><cell/><cell/><cell/><cell/><cell/><cell/><cell/>
    </row>
    <row>
        <cell/><cell/><cell/><cell/><cell/><cell/><cell/><cell/><cell/>
    </row>
    <row>
        <cell/><cell/><cell/><cell/><cell/><cell/><cell/><cell/><cell/>
    </row>
    <row>
        <cell/><cell/><cell/><cell/><cell/><cell/><cell/><cell/><cell/>
    </row>
    <row>
        <cell/><cell/><cell/><cell/><cell/><cell/><cell/><cell/><cell/>
    </row>
    <row>
        <cell/><cell/><cell/><cell/><cell/><cell/><cell/><cell/><cell/>
    </row>
    <row>
        <cell/><cell/><cell/><cell/><cell/><cell/><cell/><cell/><cell/>
    </row>
    
</sudoku>
